{
  "room_type": "living_room",
  "label": "Living Room",
  "version": "2.0",

  "sections": {

    "geometry": [
      {
        "key": "room_length_m",
        "label": "Room Length",
        "type": "range",
        "unit": "m",
        "range": [3.5, 7.0],
        "step": 0.5,
        "default": 5.5,
        "routing": "regeneration",
        "construct": "perceived spaciousness / movement affordance",
        "rationale": "Floor plan area is a primary determinant of perceived spaciousness. Longer rooms alter sightlines, furniture arrangement options, and sense of freedom versus confinement.",
        "citation": "Evans (2003); Clements-Croome (2006)",
        "infinigen_param": null
      },
      {
        "key": "room_width_m",
        "label": "Room Width",
        "type": "range",
        "unit": "m",
        "range": [3.0, 5.5],
        "step": 0.5,
        "default": 4.5,
        "routing": "regeneration",
        "construct": "perceived spaciousness / enclosure",
        "rationale": "Width relative to length controls the aspect ratio and degree of perceived enclosure. Narrow rooms increase enclosure; wider rooms increase perceived openness.",
        "citation": "Evans (2003); Nasar (1994)",
        "infinigen_param": null
      },
      {
        "key": "ceiling_height_m",
        "label": "Ceiling Height",
        "type": "range",
        "unit": "m",
        "range": [2.0, 3.5],
        "step": 0.1,
        "default": 2.7,
        "routing": "regeneration",
        "construct": "perceived openness / abstract cognition",
        "rationale": "Higher ceilings prime abstract, expansive thinking; lower ceilings prime concrete, detail-focused thinking. The 2.0–3.5 m range spans below-standard to high-end residential. Default 2.7 m approximates the empirical preference peak reported by Vartanian et al.",
        "citation": "Meyers-Levy & Zhu (2007); Vartanian et al. (2015)",
        "infinigen_param": "ceiling_height_m"
      }
    ],

    "windows": [
      {
        "key": "window_count",
        "label": "Number of Windows",
        "type": "integer",
        "unit": "count",
        "range": [1, 4],
        "default": 2,
        "routing": "regeneration",
        "construct": "daylight access / view quality / restorative potential",
        "rationale": "Window count affects both the total daylight admitted and the number of view opportunities. Views of the exterior—particularly nature—support attention restoration and stress reduction.",
        "citation": "Kaplan (1993); Ulrich (1984); Heschong (1999)",
        "infinigen_param": null
      },
      {
        "key": "window_glazing_ratio",
        "label": "Window-to-Wall Ratio",
        "type": "range",
        "unit": "ratio",
        "range": [0.10, 0.40],
        "step": 0.05,
        "default": 0.20,
        "routing": "regeneration",
        "construct": "daylight factor / indoor luminance",
        "rationale": "Glazing ratio is the primary architectural determinant of daylight factor. It interacts with daylight_intensity to determine the absolute illumination level reaching occupants.",
        "citation": "Heschong (1999); Münch et al. (2020)",
        "infinigen_param": null
      },
      {
        "key": "window_sill_height_m",
        "label": "Window Sill Height",
        "type": "range",
        "unit": "m",
        "range": [0.6, 1.2],
        "step": 0.1,
        "default": 0.9,
        "routing": "regeneration",
        "construct": "seated view access",
        "rationale": "Sill height determines whether occupants can see the exterior while seated. Lower sills provide unobstructed seated views; higher sills restrict views to standing occupants.",
        "citation": "Kaplan (1993)",
        "infinigen_param": null
      },
      {
        "key": "window_treatment",
        "label": "Window Treatment",
        "type": "categorical",
        "unit": "category",
        "options": ["none", "sheer", "curtains", "blinds"],
        "default": "sheer",
        "routing": "cached",
        "construct": "daylight modulation / privacy / thermal comfort perception",
        "rationale": "Window coverings modulate admitted daylight and signal privacy level. Sheer curtains diffuse glare while maintaining view. Heavy curtains increase enclosure and reduce stimulation. The choice also acts as a material warmth cue.",
        "citation": "Münch et al. (2020); Ulrich (1991)",
        "infinigen_param": null
      },
      {
        "key": "window_view_type",
        "label": "Exterior View Type",
        "type": "categorical",
        "unit": "category",
        "options": ["nature_garden", "urban_street", "interior_courtyard", "blank_wall"],
        "default": "nature_garden",
        "routing": "cached",
        "construct": "restorative potential / stress recovery",
        "rationale": "The content of a window view—independent of window size—is a strong predictor of stress recovery and attention restoration. Nature views consistently outperform built or obstructed views.",
        "citation": "Ulrich (1984); Kaplan (1993); Kaplan & Kaplan (1989)",
        "infinigen_param": null
      }
    ],

    "doors": [
      {
        "key": "door_count",
        "label": "Number of Doors",
        "type": "integer",
        "unit": "count",
        "range": [1, 3],
        "default": 1,
        "routing": "regeneration",
        "construct": "spatial connectivity / perceived escape affordance",
        "rationale": "Door count and placement affect perceived connectivity between spaces, sense of privacy, and feeling of potential escape or openness—relevant to feelings of control and safety.",
        "citation": "Gifford (2007)",
        "infinigen_param": null
      },
      {
        "key": "door_style",
        "label": "Door Style",
        "type": "categorical",
        "unit": "category",
        "options": ["flush", "paneled", "glass_panel"],
        "default": "paneled",
        "routing": "cached",
        "construct": "formality perception / visual weight",
        "rationale": "Door style contributes to perceived formality and material richness of the interior. Glass-panel doors introduce borrowed light and visual connectivity; flush doors recede into walls.",
        "citation": "Nasar (1994)",
        "infinigen_param": null
      }
    ],

    "lighting": [
      {
        "key": "daylight_intensity",
        "label": "Daylight Intensity",
        "type": "range",
        "unit": "normalised",
        "range": [0.0, 1.0],
        "step": 0.05,
        "default": 0.60,
        "routing": "live",
        "construct": "illumination / restoration / circadian entrainment",
        "rationale": "Daylight exposure affects alertness, mood, restoration, and circadian regulation. Brighter daylight environments are associated with higher positive affect and improved cognitive performance in office and residential studies.",
        "citation": "Kaplan & Kaplan (1989); Münch et al. (2020); Heschong (1999)",
        "infinigen_param": "daylight_intensity"
      },
      {
        "key": "artificial_light_intensity",
        "label": "Artificial Light Intensity",
        "type": "range",
        "unit": "normalised",
        "range": [0.0, 1.0],
        "step": 0.05,
        "default": 0.35,
        "routing": "live",
        "construct": "supplemental illumination / mood / perceived time-of-day",
        "rationale": "Artificial lighting supplements daylight and is the primary light source in evening conditions. Higher intensity artificial light increases arousal and perceived energy level; lower intensity creates a more intimate atmosphere.",
        "citation": "Knez (1995); van Duijnhoven et al. (2017)",
        "infinigen_param": null
      },
      {
        "key": "light_color_temperature_k",
        "label": "Light Color Temperature",
        "type": "range",
        "unit": "K",
        "range": [2700, 6500],
        "step": 100,
        "default": 3000,
        "routing": "live",
        "construct": "arousal / valence / circadian phase",
        "rationale": "Warm light (2700–3000 K) is associated with relaxation, lower arousal, and evening-appropriate environments. Cool light (5000–6500 K) increases alertness, accuracy, and corresponds to midday daylight. This parameter controls the spectral character of both artificial and ambient sky colour.",
        "citation": "Knez (1995); Küller et al. (2006); van Duijnhoven et al. (2017)",
        "infinigen_param": null
      },
      {
        "key": "primary_light_source",
        "label": "Primary Light Source Type",
        "type": "categorical",
        "unit": "category",
        "options": ["ceiling_overhead", "floor_lamp", "table_lamp", "recessed", "mixed"],
        "default": "mixed",
        "routing": "cached",
        "construct": "light distribution / perceived intimacy / vertical illumination ratio",
        "rationale": "Light source type determines the distribution and directionality of illumination. Overhead lighting produces flat, even light; floor and table lamps create pools of warm light associated with intimacy and reduced visual fatigue.",
        "citation": "Knez (1995); Veitch & Newsham (1998)",
        "infinigen_param": null
      },
      {
        "key": "shadow_softness",
        "label": "Shadow Softness",
        "type": "range",
        "unit": "normalised",
        "range": [0.0, 1.0],
        "step": 0.1,
        "default": 0.6,
        "routing": "cached",
        "construct": "perceived time-of-day / visual comfort",
        "rationale": "Sharp shadows (low value) suggest direct, high-altitude sunlight or hard artificial sources. Soft shadows suggest diffuse overcast sky or softbox-style sources. Shadow character is a strong cue for perceived time of day and light quality.",
        "citation": "Boyce et al. (2003)",
        "infinigen_param": null
      }
    ],

    "materials": [
      {
        "key": "wall_hue_deg",